{
  "name": "resolution-without-choice",
  "description": "The double-scan, after HQ marked tablet-a's copy resolved with chosen_txn null (the way an unexpected_check_in is closed; for a fork it chooses nothing). The resolution matches the fork but names no branch, so it settles nothing: the unit stays disputed and the fork's resolved_by is null. It still matches the exception's dispute_key and transactions, so the detector writes nothing new (rule 7); HQ edits the resolution to choose a branch. A build that treats chosen_txn null as settling the fork gives the unit a holder; one that treats the resolution as not counting re-emits the exception.",
  "order_independent": true,
  "trip": "trip-2026-10-18-riverfest",
  "box": "box-07",
  "store": "store-richmond",
  "inventory": null,
  "transactions": [
    {
      "_id": "txn::1792328410000-0000-tablet-a",
      "v": 1,
      "type": "transaction",
      "trip": "trip-2026-10-18-riverfest",
      "box": "box-07",
      "kind": "check_out",
      "unit_id": "JKT-RAIN-M-BLU#001",
      "sku": "JKT-RAIN-M-BLU",
      "from_custodian": "store-richmond",
      "to_custodian": "box-07",
      "prev_txn": null,
      "from_allocation": null,
      "to_allocation": "alloc::1792328400000-0000-tablet-a",
      "device": "tablet-a",
      "hlc": "1792328410000-0000-tablet-a",
      "device_clock": "2026-10-18T13:00:10Z",
      "box_clock": null,
      "basket": null,
      "price": null,
      "tender": null
    },
    {
      "_id": "txn::1792328510000-0000-tablet-a",
      "v": 1,
      "type": "transaction",
      "trip": "trip-2026-10-18-riverfest",
      "box": "box-07",
      "kind": "check_out",
      "unit_id": "JKT-RAIN-M-BLU#001",
      "sku": "JKT-RAIN-M-BLU",
      "from_custodian": "box-07",
      "to_custodian": "tablet-a",
      "prev_txn": "txn::1792328410000-0000-tablet-a",
      "from_allocation": "alloc::1792328400000-0000-tablet-a",
      "to_allocation": "alloc::1792328500000-0000-tablet-a",
      "device": "tablet-a",
      "hlc": "1792328510000-0000-tablet-a",
      "device_clock": "2026-10-18T13:01:50Z",
      "box_clock": null,
      "basket": null,
      "price": null,
      "tender": null
    },
    {
      "_id": "txn::1792328511000-0000-tablet-b",
      "v": 1,
      "type": "transaction",
      "trip": "trip-2026-10-18-riverfest",
      "box": "box-07",
      "kind": "check_out",
      "unit_id": "JKT-RAIN-M-BLU#001",
      "sku": "JKT-RAIN-M-BLU",
      "from_custodian": "box-07",
      "to_custodian": "tablet-b",
      "prev_txn": "txn::1792328410000-0000-tablet-a",
      "from_allocation": "alloc::1792328400000-0000-tablet-a",
      "to_allocation": "alloc::1792328501000-0000-tablet-b",
      "device": "tablet-b",
      "hlc": "1792328511000-0000-tablet-b",
      "device_clock": "2026-10-18T13:01:51Z",
      "box_clock": null,
      "basket": null,
      "price": null,
      "tender": null
    }
  ],
  "resolutions": [
    {
      "_id": "exc::tablet-a::JKT-RAIN-M-BLU#001::111c7a4e",
      "v": 1,
      "type": "exception",
      "trip": "trip-2026-10-18-riverfest",
      "box": "box-07",
      "kind": "double_scan",
      "unit_id": "JKT-RAIN-M-BLU#001",
      "sku": "JKT-RAIN-M-BLU",
      "dispute_key": "JKT-RAIN-M-BLU#001|txn::1792328410000-0000-tablet-a",
      "fork_txn": "txn::1792328410000-0000-tablet-a",
      "transactions": [
        "txn::1792328510000-0000-tablet-a",
        "txn::1792328511000-0000-tablet-b"
      ],
      "branches": [
        {
          "txn": "txn::1792328510000-0000-tablet-a",
          "device": "tablet-a",
          "kind": "check_out",
          "to_custodian": "tablet-a",
          "hlc": "1792328510000-0000-tablet-a"
        },
        {
          "txn": "txn::1792328511000-0000-tablet-b",
          "device": "tablet-b",
          "kind": "check_out",
          "to_custodian": "tablet-b",
          "hlc": "1792328511000-0000-tablet-b"
        }
      ],
      "proposed_resolution": {
        "action": "review",
        "note": "Scanned out twice. Choose the movement that matches where the unit is."
      },
      "status": "resolved",
      "resolution": {
        "by": "hq",
        "at": "2026-10-18T13:30:00Z",
        "hlc": "1792330200000-0000-hq",
        "chosen_txn": null,
        "note": "Seen. Still checking which tablet has it."
      },
      "detected_by": "tablet-a",
      "detected_at": "1792328520000-0000-tablet-a"
    }
  ],
  "expected": {
    "units": {
      "JKT-RAIN-M-BLU#001": {
        "sku": "JKT-RAIN-M-BLU",
        "holder": null,
        "allocation": null,
        "state": "disputed",
        "last_txn": null
      }
    },
    "counts": [],
    "allocation_counts": {
      "alloc::1792328400000-0000-tablet-a": 0,
      "alloc::1792328500000-0000-tablet-a": 0,
      "alloc::1792328501000-0000-tablet-b": 0
    },
    "forks": [
      {
        "unit_id": "JKT-RAIN-M-BLU#001",
        "sku": "JKT-RAIN-M-BLU",
        "prev_txn": "txn::1792328410000-0000-tablet-a",
        "branches": [
          "txn::1792328510000-0000-tablet-a",
          "txn::1792328511000-0000-tablet-b"
        ],
        "resolved_by": null
      }
    ],
    "exceptions": {
      "detector": "tablet-a",
      "docs": []
    },
    "conservation": {
      "with_inventory": null,
      "venue_only": [
        {
          "sku": "JKT-RAIN-M-BLU",
          "opening_on_hand": null,
          "received": null,
          "left_store": 1,
          "untraced": 0,
          "returned_to_store": 0,
          "store_on_hand": null,
          "in_custody": {},
          "sold": 0,
          "disputed": 1,
          "holds": true
        }
      ]
    },
    "drops": []
  }
}
