{
  "name": "foreign-sale",
  "description": "tablet-b takes #001 off the box; tablet-a then sells it, naming tablet-b's take as prev_txn: a sale by a device that did not hold the unit (the customer carried it from tablet-b's table and paid at tablet-a). The chain is unbroken, so the unit is sold and no fork exists; the sale is foreign (rule 8: its from_custodian is neither tablet-a nor box-07), so it stands and one foreign_movement exception attaches the sale and its prev_txn. A build without rule 8 writes nothing; one that treats the sale as a blind movement from tablet-b changes nothing here but fails second-level-take.",
  "order_independent": true,
  "trip": "trip-2026-10-18-riverfest",
  "box": "box-07",
  "store": "store-richmond",
  "inventory": null,
  "transactions": [
    {
      "_id": "txn::1792328410000-0000-tablet-a",
      "v": 1,
      "type": "transaction",
      "trip": "trip-2026-10-18-riverfest",
      "box": "box-07",
      "kind": "check_out",
      "unit_id": "JKT-RAIN-M-BLU#001",
      "sku": "JKT-RAIN-M-BLU",
      "from_custodian": "store-richmond",
      "to_custodian": "box-07",
      "prev_txn": null,
      "from_allocation": null,
      "to_allocation": "alloc::1792328400000-0000-tablet-a",
      "device": "tablet-a",
      "hlc": "1792328410000-0000-tablet-a",
      "device_clock": "2026-10-18T13:00:10Z",
      "box_clock": null,
      "basket": null,
      "price": null,
      "tender": null
    },
    {
      "_id": "txn::1792328511000-0000-tablet-b",
      "v": 1,
      "type": "transaction",
      "trip": "trip-2026-10-18-riverfest",
      "box": "box-07",
      "kind": "check_out",
      "unit_id": "JKT-RAIN-M-BLU#001",
      "sku": "JKT-RAIN-M-BLU",
      "from_custodian": "box-07",
      "to_custodian": "tablet-b",
      "prev_txn": "txn::1792328410000-0000-tablet-a",
      "from_allocation": "alloc::1792328400000-0000-tablet-a",
      "to_allocation": "alloc::1792328501000-0000-tablet-b",
      "device": "tablet-b",
      "hlc": "1792328511000-0000-tablet-b",
      "device_clock": "2026-10-18T13:01:51Z",
      "box_clock": null,
      "basket": null,
      "price": null,
      "tender": null
    },
    {
      "_id": "txn::1792329000000-0000-tablet-a",
      "v": 1,
      "type": "transaction",
      "trip": "trip-2026-10-18-riverfest",
      "box": "box-07",
      "kind": "sale",
      "unit_id": "JKT-RAIN-M-BLU#001",
      "sku": "JKT-RAIN-M-BLU",
      "from_custodian": "tablet-b",
      "to_custodian": "customer",
      "prev_txn": "txn::1792328511000-0000-tablet-b",
      "from_allocation": "alloc::1792328501000-0000-tablet-b",
      "to_allocation": null,
      "device": "tablet-a",
      "hlc": "1792329000000-0000-tablet-a",
      "device_clock": "2026-10-18T13:10:00Z",
      "box_clock": null,
      "basket": "7c9e6679-7425-40de-944b-e07fc1f90ae7",
      "price": {
        "cents": 12900,
        "currency": "USD"
      },
      "tender": {
        "kind": "cash",
        "amount": {
          "cents": 12900,
          "currency": "USD"
        }
      }
    }
  ],
  "resolutions": [],
  "expected": {
    "units": {
      "JKT-RAIN-M-BLU#001": {
        "sku": "JKT-RAIN-M-BLU",
        "holder": "customer",
        "allocation": null,
        "state": "sold",
        "last_txn": "txn::1792329000000-0000-tablet-a"
      }
    },
    "counts": [],
    "allocation_counts": {
      "alloc::1792328400000-0000-tablet-a": 0,
      "alloc::1792328501000-0000-tablet-b": 0
    },
    "forks": [],
    "exceptions": {
      "detector": "tablet-a",
      "docs": [
        {
          "_id": "exc::tablet-a::JKT-RAIN-M-BLU#001::74f5bc5e",
          "v": 1,
          "type": "exception",
          "trip": "trip-2026-10-18-riverfest",
          "box": "box-07",
          "kind": "foreign_movement",
          "unit_id": "JKT-RAIN-M-BLU#001",
          "sku": "JKT-RAIN-M-BLU",
          "dispute_key": "JKT-RAIN-M-BLU#001|txn::1792329000000-0000-tablet-a",
          "fork_txn": null,
          "transactions": [
            "txn::1792328511000-0000-tablet-b",
            "txn::1792329000000-0000-tablet-a"
          ],
          "branches": [
            {
              "txn": "txn::1792328511000-0000-tablet-b",
              "device": "tablet-b",
              "kind": "check_out",
              "to_custodian": "tablet-b",
              "hlc": "1792328511000-0000-tablet-b"
            },
            {
              "txn": "txn::1792329000000-0000-tablet-a",
              "device": "tablet-a",
              "kind": "sale",
              "to_custodian": "customer",
              "hlc": "1792329000000-0000-tablet-a"
            }
          ],
          "proposed_resolution": {
            "action": "review",
            "note": "Moved by a device that did not hold it. Confirm where the unit is."
          },
          "status": "open",
          "resolution": null,
          "detected_by": "tablet-a"
        }
      ]
    },
    "conservation": {
      "with_inventory": null,
      "venue_only": [
        {
          "sku": "JKT-RAIN-M-BLU",
          "opening_on_hand": null,
          "received": null,
          "left_store": 1,
          "untraced": 0,
          "returned_to_store": 0,
          "store_on_hand": null,
          "in_custody": {},
          "sold": 1,
          "disputed": 0,
          "holds": true
        }
      ]
    },
    "drops": []
  }
}
