{
  "name": "fork-inside-set-aside-branch",
  "description": "The double-scan after HQ chose tablet-a's take (resolved-fork), continued on the branch HQ set aside: tablet-b, which never saw the resolution, checks #001 in to the box, and then phone-1 and tablet-b both take it off the box, each naming that check-in. The two takes fork at the check-in, but the check-in descends from the branch HQ set aside, and set-aside movements are ignored for holder, counts, forks and exceptions (rule 3): the fork is not reported, nothing is written and tablet-a keeps the unit. A build that reports every fork in the forest marks the unit disputed and writes a double_scan HQ already answered.",
  "order_independent": true,
  "trip": "trip-2026-10-18-riverfest",
  "box": "box-07",
  "store": "store-richmond",
  "inventory": null,
  "transactions": [
    {
      "_id": "txn::1792328410000-0000-tablet-a",
      "v": 1,
      "type": "transaction",
      "trip": "trip-2026-10-18-riverfest",
      "box": "box-07",
      "kind": "check_out",
      "unit_id": "JKT-RAIN-M-BLU#001",
      "sku": "JKT-RAIN-M-BLU",
      "from_custodian": "store-richmond",
      "to_custodian": "box-07",
      "prev_txn": null,
      "from_allocation": null,
      "to_allocation": "alloc::1792328400000-0000-tablet-a",
      "device": "tablet-a",
      "hlc": "1792328410000-0000-tablet-a",
      "device_clock": "2026-10-18T13:00:10Z",
      "box_clock": null,
      "basket": null,
      "price": null,
      "tender": null
    },
    {
      "_id": "txn::1792328510000-0000-tablet-a",
      "v": 1,
      "type": "transaction",
      "trip": "trip-2026-10-18-riverfest",
      "box": "box-07",
      "kind": "check_out",
      "unit_id": "JKT-RAIN-M-BLU#001",
      "sku": "JKT-RAIN-M-BLU",
      "from_custodian": "box-07",
      "to_custodian": "tablet-a",
      "prev_txn": "txn::1792328410000-0000-tablet-a",
      "from_allocation": "alloc::1792328400000-0000-tablet-a",
      "to_allocation": "alloc::1792328500000-0000-tablet-a",
      "device": "tablet-a",
      "hlc": "1792328510000-0000-tablet-a",
      "device_clock": "2026-10-18T13:01:50Z",
      "box_clock": null,
      "basket": null,
      "price": null,
      "tender": null
    },
    {
      "_id": "txn::1792328511000-0000-tablet-b",
      "v": 1,
      "type": "transaction",
      "trip": "trip-2026-10-18-riverfest",
      "box": "box-07",
      "kind": "check_out",
      "unit_id": "JKT-RAIN-M-BLU#001",
      "sku": "JKT-RAIN-M-BLU",
      "from_custodian": "box-07",
      "to_custodian": "tablet-b",
      "prev_txn": "txn::1792328410000-0000-tablet-a",
      "from_allocation": "alloc::1792328400000-0000-tablet-a",
      "to_allocation": "alloc::1792328501000-0000-tablet-b",
      "device": "tablet-b",
      "hlc": "1792328511000-0000-tablet-b",
      "device_clock": "2026-10-18T13:01:51Z",
      "box_clock": null,
      "basket": null,
      "price": null,
      "tender": null
    },
    {
      "_id": "txn::1792330400000-0000-tablet-b",
      "v": 1,
      "type": "transaction",
      "trip": "trip-2026-10-18-riverfest",
      "box": "box-07",
      "kind": "check_in",
      "unit_id": "JKT-RAIN-M-BLU#001",
      "sku": "JKT-RAIN-M-BLU",
      "from_custodian": "tablet-b",
      "to_custodian": "box-07",
      "prev_txn": "txn::1792328511000-0000-tablet-b",
      "from_allocation": "alloc::1792328501000-0000-tablet-b",
      "to_allocation": "alloc::1792328400000-0000-tablet-a",
      "device": "tablet-b",
      "hlc": "1792330400000-0000-tablet-b",
      "device_clock": "2026-10-18T13:33:20Z",
      "box_clock": null,
      "basket": null,
      "price": null,
      "tender": null
    },
    {
      "_id": "txn::1792330800000-0000-phone-1",
      "v": 1,
      "type": "transaction",
      "trip": "trip-2026-10-18-riverfest",
      "box": "box-07",
      "kind": "check_out",
      "unit_id": "JKT-RAIN-M-BLU#001",
      "sku": "JKT-RAIN-M-BLU",
      "from_custodian": "box-07",
      "to_custodian": "phone-1",
      "prev_txn": "txn::1792330400000-0000-tablet-b",
      "from_allocation": "alloc::1792328400000-0000-tablet-a",
      "to_allocation": "alloc::1792330700000-0000-phone-1",
      "device": "phone-1",
      "hlc": "1792330800000-0000-phone-1",
      "device_clock": "2026-10-18T13:40:00Z",
      "box_clock": null,
      "basket": null,
      "price": null,
      "tender": null
    },
    {
      "_id": "txn::1792330801000-0000-tablet-b",
      "v": 1,
      "type": "transaction",
      "trip": "trip-2026-10-18-riverfest",
      "box": "box-07",
      "kind": "check_out",
      "unit_id": "JKT-RAIN-M-BLU#001",
      "sku": "JKT-RAIN-M-BLU",
      "from_custodian": "box-07",
      "to_custodian": "tablet-b",
      "prev_txn": "txn::1792330400000-0000-tablet-b",
      "from_allocation": "alloc::1792328400000-0000-tablet-a",
      "to_allocation": "alloc::1792330790000-0000-tablet-b",
      "device": "tablet-b",
      "hlc": "1792330801000-0000-tablet-b",
      "device_clock": "2026-10-18T13:40:01Z",
      "box_clock": null,
      "basket": null,
      "price": null,
      "tender": null
    }
  ],
  "resolutions": [
    {
      "_id": "exc::tablet-a::JKT-RAIN-M-BLU#001::111c7a4e",
      "v": 1,
      "type": "exception",
      "trip": "trip-2026-10-18-riverfest",
      "box": "box-07",
      "kind": "double_scan",
      "unit_id": "JKT-RAIN-M-BLU#001",
      "sku": "JKT-RAIN-M-BLU",
      "dispute_key": "JKT-RAIN-M-BLU#001|txn::1792328410000-0000-tablet-a",
      "fork_txn": "txn::1792328410000-0000-tablet-a",
      "transactions": [
        "txn::1792328510000-0000-tablet-a",
        "txn::1792328511000-0000-tablet-b"
      ],
      "branches": [
        {
          "txn": "txn::1792328510000-0000-tablet-a",
          "device": "tablet-a",
          "kind": "check_out",
          "to_custodian": "tablet-a",
          "hlc": "1792328510000-0000-tablet-a"
        },
        {
          "txn": "txn::1792328511000-0000-tablet-b",
          "device": "tablet-b",
          "kind": "check_out",
          "to_custodian": "tablet-b",
          "hlc": "1792328511000-0000-tablet-b"
        }
      ],
      "proposed_resolution": {
        "action": "review",
        "note": "Scanned out twice. Choose the movement that matches where the unit is."
      },
      "status": "resolved",
      "resolution": {
        "by": "hq",
        "at": "2026-10-18T13:30:00Z",
        "hlc": "1792330200000-0000-hq",
        "chosen_txn": "txn::1792328510000-0000-tablet-a",
        "note": "tablet-a has the jacket."
      },
      "detected_by": "tablet-a",
      "detected_at": "1792328520000-0000-tablet-a"
    }
  ],
  "expected": {
    "units": {
      "JKT-RAIN-M-BLU#001": {
        "sku": "JKT-RAIN-M-BLU",
        "holder": "tablet-a",
        "allocation": "alloc::1792328500000-0000-tablet-a",
        "state": "held",
        "last_txn": "txn::1792328510000-0000-tablet-a"
      }
    },
    "counts": [
      {
        "custodian": "tablet-a",
        "sku": "JKT-RAIN-M-BLU",
        "qty": 1
      }
    ],
    "allocation_counts": {
      "alloc::1792328400000-0000-tablet-a": 0,
      "alloc::1792328500000-0000-tablet-a": 1,
      "alloc::1792328501000-0000-tablet-b": 0,
      "alloc::1792330700000-0000-phone-1": 0,
      "alloc::1792330790000-0000-tablet-b": 0
    },
    "forks": [
      {
        "unit_id": "JKT-RAIN-M-BLU#001",
        "sku": "JKT-RAIN-M-BLU",
        "prev_txn": "txn::1792328410000-0000-tablet-a",
        "branches": [
          "txn::1792328510000-0000-tablet-a",
          "txn::1792328511000-0000-tablet-b"
        ],
        "resolved_by": "exc::tablet-a::JKT-RAIN-M-BLU#001::111c7a4e"
      }
    ],
    "exceptions": {
      "detector": "tablet-a",
      "docs": []
    },
    "conservation": {
      "with_inventory": null,
      "venue_only": [
        {
          "sku": "JKT-RAIN-M-BLU",
          "opening_on_hand": null,
          "received": null,
          "left_store": 1,
          "untraced": 0,
          "returned_to_store": 0,
          "store_on_hand": null,
          "in_custody": {
            "tablet-a": 1
          },
          "sold": 0,
          "disputed": 0,
          "holds": true
        }
      ]
    },
    "drops": []
  }
}
