{
  "name": "dangling-predecessor",
  "description": "Only a check-in has arrived; the movement it names as its predecessor has not. Not an error and not a fork: the box holds the unit.",
  "order_independent": true,
  "trip": "trip-2026-10-18-riverfest",
  "box": "box-07",
  "store": "store-richmond",
  "inventory": null,
  "transactions": [
    {
      "_id": "txn::1792328600000-0000-tablet-b",
      "v": 1,
      "type": "transaction",
      "trip": "trip-2026-10-18-riverfest",
      "box": "box-07",
      "kind": "check_in",
      "unit_id": "JKT-RAIN-M-BLU#001",
      "sku": "JKT-RAIN-M-BLU",
      "from_custodian": "tablet-b",
      "to_custodian": "box-07",
      "prev_txn": "txn::1792328500000-0000-tablet-b",
      "from_allocation": "alloc::1792328450000-0000-tablet-b",
      "to_allocation": "alloc::1792328400000-0000-tablet-a",
      "device": "tablet-b",
      "hlc": "1792328600000-0000-tablet-b",
      "device_clock": "2026-10-18T13:03:20Z",
      "box_clock": null,
      "basket": null,
      "price": null,
      "tender": null
    }
  ],
  "resolutions": [],
  "expected": {
    "units": {
      "JKT-RAIN-M-BLU#001": {
        "sku": "JKT-RAIN-M-BLU",
        "holder": "box-07",
        "allocation": "alloc::1792328400000-0000-tablet-a",
        "state": "held",
        "last_txn": "txn::1792328600000-0000-tablet-b"
      }
    },
    "counts": [
      {
        "custodian": "box-07",
        "sku": "JKT-RAIN-M-BLU",
        "qty": 1
      }
    ],
    "allocation_counts": {
      "alloc::1792328400000-0000-tablet-a": 1,
      "alloc::1792328450000-0000-tablet-b": 0
    },
    "forks": [],
    "exceptions": {
      "detector": "tablet-a",
      "docs": []
    },
    "conservation": {
      "with_inventory": null,
      "venue_only": [
        {
          "sku": "JKT-RAIN-M-BLU",
          "opening_on_hand": null,
          "received": null,
          "left_store": 1,
          "untraced": 0,
          "returned_to_store": 0,
          "store_on_hand": null,
          "in_custody": {
            "box-07": 1
          },
          "sold": 0,
          "disputed": 0,
          "holds": true
        }
      ]
    },
    "drops": []
  }
}
