{
  "name": "closed-unexpected-check-in-predecessor-arrives",
  "description": "unexpected-check-in, after HQ closed the check-in (chosen_txn null) while it had only the pack and the check-in: its document attaches the check-in alone. tablet-a's take, the check-in's prev_txn, has since arrived, so the exception the detector would write attaches both and gets a new id, but the closure holds (rule 7: kind and dispute_key, whatever the transactions; in 0.5.0 it reopened). The box holds the unit and nothing is written. A build that matches the closure on transactions too writes exc::tablet-a::JKT-RAIN-M-BLU#001::091fc3c3.",
  "order_independent": true,
  "trip": "trip-2026-10-18-riverfest",
  "box": "box-07",
  "store": "store-richmond",
  "inventory": null,
  "transactions": [
    {
      "_id": "txn::1792328410000-0000-tablet-a",
      "v": 1,
      "type": "transaction",
      "trip": "trip-2026-10-18-riverfest",
      "box": "box-07",
      "kind": "check_out",
      "unit_id": "JKT-RAIN-M-BLU#001",
      "sku": "JKT-RAIN-M-BLU",
      "from_custodian": "store-richmond",
      "to_custodian": "box-07",
      "prev_txn": null,
      "from_allocation": null,
      "to_allocation": "alloc::1792328400000-0000-tablet-a",
      "device": "tablet-a",
      "hlc": "1792328410000-0000-tablet-a",
      "device_clock": "2026-10-18T13:00:10Z",
      "box_clock": null,
      "basket": null,
      "price": null,
      "tender": null
    },
    {
      "_id": "txn::1792328510000-0000-tablet-a",
      "v": 1,
      "type": "transaction",
      "trip": "trip-2026-10-18-riverfest",
      "box": "box-07",
      "kind": "check_out",
      "unit_id": "JKT-RAIN-M-BLU#001",
      "sku": "JKT-RAIN-M-BLU",
      "from_custodian": "box-07",
      "to_custodian": "tablet-a",
      "prev_txn": "txn::1792328410000-0000-tablet-a",
      "from_allocation": "alloc::1792328400000-0000-tablet-a",
      "to_allocation": "alloc::1792328500000-0000-tablet-a",
      "device": "tablet-a",
      "hlc": "1792328510000-0000-tablet-a",
      "device_clock": "2026-10-18T13:01:50Z",
      "box_clock": null,
      "basket": null,
      "price": null,
      "tender": null
    },
    {
      "_id": "txn::1792328900000-0000-tablet-b",
      "v": 1,
      "type": "transaction",
      "trip": "trip-2026-10-18-riverfest",
      "box": "box-07",
      "kind": "check_in",
      "unit_id": "JKT-RAIN-M-BLU#001",
      "sku": "JKT-RAIN-M-BLU",
      "from_custodian": "tablet-a",
      "to_custodian": "box-07",
      "prev_txn": "txn::1792328510000-0000-tablet-a",
      "from_allocation": "alloc::1792328500000-0000-tablet-a",
      "to_allocation": "alloc::1792328400000-0000-tablet-a",
      "device": "tablet-b",
      "hlc": "1792328900000-0000-tablet-b",
      "device_clock": "2026-10-18T13:08:20Z",
      "box_clock": null,
      "basket": null,
      "price": null,
      "tender": null
    }
  ],
  "resolutions": [
    {
      "_id": "exc::hq::JKT-RAIN-M-BLU#001::6ca91da0",
      "v": 1,
      "type": "exception",
      "trip": "trip-2026-10-18-riverfest",
      "box": null,
      "kind": "unexpected_check_in",
      "unit_id": "JKT-RAIN-M-BLU#001",
      "sku": "JKT-RAIN-M-BLU",
      "dispute_key": "JKT-RAIN-M-BLU#001|txn::1792328900000-0000-tablet-b",
      "fork_txn": null,
      "transactions": [
        "txn::1792328900000-0000-tablet-b"
      ],
      "branches": [
        {
          "txn": "txn::1792328900000-0000-tablet-b",
          "device": "tablet-b",
          "kind": "check_in",
          "to_custodian": "box-07",
          "hlc": "1792328900000-0000-tablet-b"
        }
      ],
      "proposed_resolution": {
        "action": "review",
        "note": "Checked in by a device that did not hold it. Confirm where the unit is."
      },
      "status": "resolved",
      "resolution": {
        "by": "hq",
        "at": "2026-10-18T13:20:00Z",
        "hlc": "1792329600000-0000-hq",
        "chosen_txn": null,
        "note": "tablet-b put it back on the box table. It is there."
      },
      "detected_by": "hq",
      "detected_at": "1792328960000-0000-hq"
    }
  ],
  "expected": {
    "units": {
      "JKT-RAIN-M-BLU#001": {
        "sku": "JKT-RAIN-M-BLU",
        "holder": "box-07",
        "allocation": "alloc::1792328400000-0000-tablet-a",
        "state": "held",
        "last_txn": "txn::1792328900000-0000-tablet-b"
      }
    },
    "counts": [
      {
        "custodian": "box-07",
        "sku": "JKT-RAIN-M-BLU",
        "qty": 1
      }
    ],
    "allocation_counts": {
      "alloc::1792328400000-0000-tablet-a": 1,
      "alloc::1792328500000-0000-tablet-a": 0
    },
    "forks": [],
    "exceptions": {
      "detector": "tablet-a",
      "docs": []
    },
    "conservation": {
      "with_inventory": null,
      "venue_only": [
        {
          "sku": "JKT-RAIN-M-BLU",
          "opening_on_hand": null,
          "received": null,
          "left_store": 1,
          "untraced": 0,
          "returned_to_store": 0,
          "store_on_hand": null,
          "in_custody": {
            "box-07": 1
          },
          "sold": 0,
          "disputed": 0,
          "holds": true
        }
      ]
    },
    "drops": []
  }
}
